name,brand,category,abv,volume_ml,origin,avg_price,tasting_notes,source,verified
"메종 죠하네스 부베, 발리니 브뤼 블랑 드 블랑",메종 죠하네스 부베 Maison Johanès Boubée,wine,,750,프랑스,,스파클링,wine21,true
샤또 뚜르 드 프레삭,샤또 뚜르 드 프레삭 Chateau Tour de Pressac,wine,,750,프랑스,,레드 · 생-떼밀리옹 그랑 크뤼,wine21,true
"스밋지, 맷 웽크 랑혼 크릭 쉬라즈",스밋지 와인즈 Smidge Wines,wine,,750,호주,,레드 · 랭혼 크릭,wine21,true
"지공다스 라 꺄브, 시그니처",지공다스 라 까브 Gigondas la Cave,wine,,750,프랑스,,레드 · 지공다스,wine21,true
"도멘 드 라 그라베레트, 꼬뜨 뒤 론",도멘 드 라 그라베레트 Domaine de la Graveirette,wine,,750,프랑스,,레드 · 꼬뜨 뒤 론,wine21,true
"파 니엔테, 포스트 & 빔 샤도네이",파니엔테 와이너리 Far Niente Winery,wine,,750,미국,,화이트 · 나파 밸리,wine21,true
"크룹 브라더스 에스테이트, 베레종",크룹 브라더스 에스테이트 Krupp Brothers Estate,wine,,750,미국,,레드 · 나파 밸리,wine21,true
"크룹 브라더스 에스테이트, M5 카베르네 소비뇽",크룹 브라더스 에스테이트 Krupp Brothers Estate,wine,,750,미국,,레드 · 나파 밸리,wine21,true
"크룹 브라더스 에스테이트, 더 휠맨",크룹 브라더스 에스테이트 Krupp Brothers Estate,wine,,750,미국,,레드 · 나파 밸리,wine21,true
"크룹 브라더스 에스테이트, 싱크로니",크룹 브라더스 에스테이트 Krupp Brothers Estate,wine,,750,미국,,레드 · 나파 밸리,wine21,true
"크룹 브라더스 에스테이트, 카베르네 소비뇽",크룹 브라더스 에스테이트 Krupp Brothers Estate,wine,,750,미국,,레드 · 나파 밸리,wine21,true
"샤토 테이시에, 생테밀리옹 그랑 크뤼",샤토 테이시에 Chateau Teyssier,wine,,750,프랑스,,레드 · 생-떼밀리옹 · 92점,wine21,true
"로카 디 몬테그로시, 제레미아",로카 디 몬테그로시 Rocca Di Montegrossi,wine,,750,이탈리아,,레드 · 키안티 · 94.5점,wine21,true
"텍스트북, 소노마 샤도네이",조나단 페이 Jonathan Pey,wine,,750,미국,,화이트 · 소노마 카운티 · 92점,wine21,true
"고스트 블락, 싱글 빈야드 카베르네 쇼비뇽",고스트 블락 와이너리  Ghost Block Winery,wine,,750,미국,,레드 · 욘트빌 · 95점,wine21,true
"안드레아스 오스터 와이너리, 지벤스타인 피노 누아",안드레아스 오스터 와이너리 Andreas Oster Winery,wine,,750,독일,,레드 · 팔츠,wine21,true
"안드레아스 오스터 와이너리, 지벤스타인 리슬링",안드레아스 오스터 와이너리 Andreas Oster Winery,wine,,750,독일,,화이트 · 팔츠,wine21,true
"안드레아스 오스터 와이너리, 호라이즌29 까베르네 블랑",안드레아스 오스터 와이너리 Andreas Oster Winery,wine,,750,독일,,화이트 · 라인헤센,wine21,true
"안드레아스 오스터 와이너리, 호라이즌29 리슬링",안드레아스 오스터 와이너리 Andreas Oster Winery,wine,,750,독일,,화이트 · 라인헤센,wine21,true
"안드레아스 오스터 와이너, 호라이즌29 팻 화이트",안드레아스 오스터 와이너리 Andreas Oster Winery,wine,,750,독일,,화이트,wine21,true
"안드레아스 오스터 와이너리, 호라이즌29 딥 벨벳",안드레아스 오스터 와이너리 Andreas Oster Winery,wine,,750,독일,,레드 · 모젤-자르-루버,wine21,true
"안드레아스 오스터 와이너리, 에이오 모젤 리슬링",안드레아스 오스터 와이너리 Andreas Oster Winery,wine,,750,독일,,화이트 · 모젤-자르-루버,wine21,true
"이든베일, 클래식 컬렉션 스파클링 로제",이든베일 베버리지  Edenvale Beverages,wine,,750,호주,,스파클링 · 사우스 오스트레일리아,wine21,true
"이든베일, 클래식 컬렉션 샤도네이",이든베일 베버리지  Edenvale Beverages,wine,,750,호주,,화이트 · 사우스 오스트레일리아,wine21,true
샤또 쌩 앙드레,샤또 쌩 앙드레 Chateau Saint Andre,wine,,750,프랑스,,레드 · 몽따뉴-생-떼밀리옹,wine21,true
"안드레아스 오스터 와이너리, 소울 드롭 논알코올 소비뇽 블랑",안드레아스 오스터 와이너리 Andreas Oster Winery,wine,,750,독일,,스파클링,wine21,true
"보데가스 페르난도 카스트로, 벤타 레알 그랑 레제르바",보데가스 페르난도 카스트로 Bodegas Fernando Castro,wine,,750,스페인,,레드 · 라 만차,wine21,true
"스킴스톤, 레드 기스 머쥐",스킴스톤 Skimstone,wine,,750,호주,,레드 · 머쥐,wine21,true
"도멘 드헤, 쥬브레 샹베르땅",도멘 드헤 Domaine Derey,wine,,750,프랑스,,레드 · 부르고뉴,wine21,true
"도멘 드헤, 픽상 '레 에샬레'",도멘 드헤 Domaine Derey,wine,,750,프랑스,,레드 · 부르고뉴,wine21,true
"도멘 드헤, 막사네 '오 셩 살로몽'",도멘 드헤 Domaine Derey,wine,,750,프랑스,,레드 · 부르고뉴,wine21,true
"도멘 드헤, 막사네 '꼬삐아껌'",도멘 드헤 Domaine Derey,wine,,750,프랑스,,레드 · 부르고뉴,wine21,true
"도멘 드헤, 막사네 블랑",도멘 드헤 Domaine Derey,wine,,750,프랑스,,화이트 · 부르고뉴,wine21,true
"도멘 드헤, 부르고뉴 루즈 '레 발렁동'",도멘 드헤 Domaine Derey,wine,,750,프랑스,,레드 · 부르고뉴,wine21,true
"도멘 드헤, 부르고뉴 루즈 '몽트흐 큘'",도멘 드헤 Domaine Derey,wine,,750,프랑스,,레드 · 부르고뉴,wine21,true
"카스텔로 몬테비비아노, 비비아노 로쏘",카스텔로 몬테비비아노 Castello Montevibiano,wine,,750,이탈리아,,레드 · 움브리아,wine21,true
"카스텔로 몬테비비아노, 비비아노 비앙코",카스텔로 몬테비비아노 Castello Montevibiano,wine,,750,이탈리아,,화이트 · 움브리아,wine21,true
"말도나도, 나파 밸리 레드 블렌드",말도나도 빈야즈 Maldonado Vineyards,wine,,750,미국,,레드 · 나파 밸리 · 90점,wine21,true
"오헬리엉 베르데, 뉘 생 조르쥬 프리미에 크뤼 '오 부도'",오헬리앙 베르데 Aurelien Verdet,wine,,750,프랑스,,레드 · 뉘-생-조르쥬 · 93점,wine21,true
"오헬리엉 베르데, 뉘 생 조르쥬 프리미에 크뤼 '레 다모드'",오헬리앙 베르데 Aurelien Verdet,wine,,750,프랑스,,레드 · 뉘-생-조르쥬 · 93점,wine21,true
"오헬리엉 베르데, 뉘 생 조르쥬 '레 오 프휘리에'",오헬리앙 베르데 Aurelien Verdet,wine,,750,프랑스,,레드 · 뉘-생-조르쥬 · 93점,wine21,true
"오헬리엉 베르데, 뉘 생 조흐쥬",오헬리앙 베르데 Aurelien Verdet,wine,,750,프랑스,,레드 · 뉘-생-조르쥬 · 90.8점,wine21,true
"오헬리엉 베르데, 막사네 '셩 뻬흐드히'",오헬리앙 베르데 Aurelien Verdet,wine,,750,프랑스,,레드 · 막사네 · 91.3점,wine21,true
"오헬리엉 베르데, 픽쌩",오헬리앙 베르데 Aurelien Verdet,wine,,750,프랑스,,레드 · 픽상,wine21,true
"오헬리엉 베르데, 셩볼 뮤지니",오헬리앙 베르데 Aurelien Verdet,wine,,750,프랑스,,레드 · 샹볼 뮈지니 · 90점,wine21,true
"오헬리엉 베르데, 본 로마네 프리미에 크뤼 '레 보 몽'",오헬리앙 베르데 Aurelien Verdet,wine,,750,프랑스,,레드 · 본-로마네 · 93점,wine21,true
"오헬리엉 베르데, 본 로마네 '비에이유 빈뉴'",오헬리앙 베르데 Aurelien Verdet,wine,,750,프랑스,,레드 · 본-로마네 · 91.8점,wine21,true
"오헬리엉 베르데, 쥬브레 셩베흐땅",오헬리앙 베르데 Aurelien Verdet,wine,,750,프랑스,,레드 · 쥬브레-샹베르땅 · 91.5점,wine21,true
"오헬리엉 베르데, 꼬뜨 드 뉘 빌라쥐 '라 프레띠에르'",오헬리앙 베르데 Aurelien Verdet,wine,,750,프랑스,,레드 · 꼬뜨 드 뉘-빌라쥬,wine21,true
"오헬리엉 베르데, 오뜨 꼬뜨 드 뉘 블랑 '르 프리외르'",오헬리앙 베르데 Aurelien Verdet,wine,,750,프랑스,,화이트 · 꼬뜨 드 뉘 · 91점,wine21,true
"오헬리엉 베르데,  부르고뉴 오뜨 꼬뜨 드 뉘 '르 프리외르'",오헬리앙 베르데 Aurelien Verdet,wine,,750,프랑스,,레드 · 꼬뜨 드 뉘 · 92점,wine21,true
"오헬리엉 베르데, 부르고뉴 '엉 뤼트니에'",오헬리앙 베르데 Aurelien Verdet,wine,,750,프랑스,,레드 · 부르고뉴,wine21,true
"칸티네 피나, 피나 네로 다볼라",칸티네 피나 Cantine Fina,wine,,750,이탈리아,,레드 · 시칠리아,wine21,true
"칸티네 피나, 피나 엘 아지즈",칸티네 피나 Cantine Fina,wine,,750,이탈리아,,화이트 · 시칠리아,wine21,true
"칸티네 피나, 피나 케브릴라 그릴로",칸티네 피나 Cantine Fina,wine,,750,이탈리아,,화이트 · 시칠리아,wine21,true
"칸티네 피나, 피나 볼라 볼라",칸티네 피나 Cantine Fina,wine,,750,이탈리아,,화이트 · 시칠리아,wine21,true
"칸티네 피나, 피나 마마리",칸티네 피나 Cantine Fina,wine,,750,이탈리아,,화이트 · 시칠리아 · 94점,wine21,true
"칸티네 피나, 피나 타이프",칸티네 피나 Cantine Fina,wine,,750,이탈리아,,화이트 · 시칠리아 · 95점,wine21,true
"칸티네 피나, 피나 키케",칸티네 피나 Cantine Fina,wine,,750,이탈리아,,화이트 · 시칠리아 · 92점,wine21,true
"보르고 임페리얼, 스푸만테 돌체",보르고 임페리얼  Borgo Imperiale,wine,,750,이탈리아,,스파클링,wine21,true
"보르고 임페리얼, 밀레지마토 스푸만테 브륏",보르고 임페리얼  Borgo Imperiale,wine,,750,이탈리아,,스파클링,wine21,true
"코바야시 와이너리, 웨더 아이 시라",코바야시 와이너리 Kobayashi Winery,wine,,750,,,레드,wine21,true
"도멘 노엘 베르세, 꼬르나스",도멘 노엘 베르세 Domaine Noel Verset,wine,,750,프랑스,,레드 · 꼬르나스,wine21,true
"보르고 임페리얼, 스푸만테 모스카토 돌체",보르고 임페리얼  Borgo Imperiale,wine,,750,이탈리아,,스파클링,wine21,true
"썸머하우스, 피노누아",썸머하우스 Summerhouse,wine,,750,뉴질랜드,,레드 · 말보로,wine21,true
"썸머하우스, 소비뇽 블랑",썸머하우스 Summerhouse,wine,,750,뉴질랜드,,화이트 · 말보로,wine21,true
"비냐 아로모, 칼레타 그란 레세르바 카르미네르",비냐 아로모 Viña Aromo,wine,,750,칠레,,레드 · 센트럴 밸리,wine21,true
"비냐 아로모, 칼레타 그란 레세르바 카베르네 소비뇽",비냐 아로모 Viña Aromo,wine,,750,칠레,,레드 · 센트럴 밸리,wine21,true
"메종 부에이, 부아 데 노스 보르도 슈페리어",메종 부에이 Maison Bouey,wine,,750,프랑스,,레드 · 보르도,wine21,true
"도멘 피에르 고농, 레 일 페레",도멘 피에르 고농 Domaine Pierre Gonon,wine,,750,프랑스,,레드 · 생-죠셉,wine21,true
"도멘 피에르 고농, 생 조셉",도멘 피에르 고농 Domaine Pierre Gonon,wine,,750,프랑스,,레드 · 생-죠셉,wine21,true
"두에레 포슈레, 풀리니 몽라셰",도멘 두에레 포슈레 Domaine Douhairet Porcheret,wine,,750,프랑스,,화이트 · 쀨리니-몽라셰,wine21,true
"두에레 포슈레, 포마르",도멘 두에레 포슈레 Domaine Douhairet Porcheret,wine,,750,프랑스,,레드 · 뽀마르,wine21,true
"두에레 포슈레, 샤샤뉴 몽라셰",도멘 두에레 포슈레 Domaine Douhairet Porcheret,wine,,750,프랑스,,화이트 · 샤샤뉴-몽라셰,wine21,true
"두에레 포슈레, 사비니 레 본",도멘 두에레 포슈레 Domaine Douhairet Porcheret,wine,,750,프랑스,,레드 · 사비니-레-본,wine21,true
"프랭크 발타자르, 꼬르나스 뀌베 카시미르 발타자르",프랭크 발타자르 Franck Balthazar,wine,,750,프랑스,,레드 · 꼬르나스,wine21,true
"두에레 포슈레, 부르고뉴 피노누아",도멘 두에레 포슈레 Domaine Douhairet Porcheret,wine,,750,프랑스,,레드 · 부르고뉴,wine21,true
"두에레 포슈레, 뫼르소",도멘 두에레 포슈레 Domaine Douhairet Porcheret,wine,,750,프랑스,,화이트 · 뫼르소,wine21,true
"메종 스테판, 꼬뜨 로띠",메종 스테판 Maison Stephan,wine,,750,프랑스,,레드 · 꼬뜨 로띠,wine21,true
"시녜 부르고뉴, 크레망",시녜 부르고뉴 Signe Bourgogne,wine,,750,프랑스,,스파클링 · 부르고뉴,wine21,true
"시녜 부르고뉴, 꼬뜨 샬로네즈 피노 누아",시녜 부르고뉴 Signe Bourgogne,wine,,750,프랑스,,레드 · 꼬뜨 샬로네즈,wine21,true
"시녜 부르고뉴, 꼬뜨 샬로네즈 샤르도네",시녜 부르고뉴 Signe Bourgogne,wine,,750,프랑스,,화이트 · 꼬뜨 샬로네즈,wine21,true
"레 비뉴롱 데스떼자르그, 에르 드 미스트랄",레 비뉴롱 데스떼자르그  Les Vignerons d'Estezargues,wine,,750,프랑스,,레드 · 꼬뜨 뒤 론,wine21,true
"레 비뉴롱 데스떼자르그, 쁠랑 쉬드",레 비뉴롱 데스떼자르그  Les Vignerons d'Estezargues,wine,,750,프랑스,,화이트 · 꼬뜨 뒤 론,wine21,true
"레 비뉴롱 데스떼자르그, 레 자미 샹또우즈",레 비뉴롱 데스떼자르그  Les Vignerons d'Estezargues,wine,,750,프랑스,,화이트 · 꼬뜨 뒤 론,wine21,true
"프랭크 발타자르, 꼬르나스",프랭크 발타자르 Franck Balthazar,wine,,750,프랑스,,레드 · 꼬르나스,wine21,true
"레 비뉴롱 데스떼자르그, 도멘 드 빼릴리에르",레 비뉴롱 데스떼자르그  Les Vignerons d'Estezargues,wine,,750,프랑스,,레드 · 꼬스띠에르 드 님,wine21,true
"프랭크 발타자르, 꼬르나스 레 샤이오",프랭크 발타자르 Franck Balthazar,wine,,750,프랑스,,레드 · 꼬르나스,wine21,true
"레 비뉴롱 데스떼자르그, 도멘 당데종",레 비뉴롱 데스떼자르그  Les Vignerons d'Estezargues,wine,,750,프랑스,,레드 · 꼬뜨 뒤 론 · 91점,wine21,true
"지모네 고네, 밀레짐 그랑 크뤼 블랑 드 블랑",지모네 고네 Gimonnet Gonet,wine,,750,프랑스,,스파클링 · 꼬뜨 데 블랑,wine21,true
"지모네 고네, 레클라 로제 그랑 크뤼",지모네 고네 Gimonnet Gonet,wine,,750,프랑스,,스파클링 · 꼬뜨 데 블랑,wine21,true
"지모네 고네, 라코르",지모네 고네 Gimonnet Gonet,wine,,750,프랑스,,스파클링 · 샹빠뉴,wine21,true
"장 뤽 콜롬보, 꼬르나스 '바용 들라질'",장 뤽 콜롬보 Jean Luc Colombo,wine,,750,프랑스,,레드 · 꼬르나스,wine21,true
"지모네 고네, 그랑 크뤼 블랑 드 블랑",지모네 고네 Gimonnet Gonet,wine,,750,프랑스,,스파클링 · 꼬뜨 데 블랑,wine21,true
샤또 라 몽도뜨,라 몽도뜨  Chateau La Mondotte,wine,,750,프랑스,,레드 · 뽀므롤,wine21,true
"엠마뉴엘 다르노, 크로제 에르미따쥬 '오 필 뒤 떵'",엠마뉴엘 다르노 Emmanuel Darnaud,wine,,750,프랑스,,레드 · 크로즈-에르미타주 · 93점,wine21,true
"엠마뉴엘 다르노, 크로즈 에르미따쥬 '미졍 부슈'",엠마뉴엘 다르노 Emmanuel Darnaud,wine,,750,프랑스,,레드 · 크로즈-에르미타주 · 91점,wine21,true
"엠마뉴엘 다르노, 크로즈 에르미따쥬 '레 트르와 쉔'",엠마뉴엘 다르노 Emmanuel Darnaud,wine,,750,프랑스,,레드 · 크로즈-에르미타주 · 93점,wine21,true
"엠마뉴엘 다르노, 에르미따쥬",엠마뉴엘 다르노 Emmanuel Darnaud,wine,,750,프랑스,,레드 · 에르미타주 · 93점,wine21,true
"엠마뉴엘 다르노, 생 조셉",엠마뉴엘 다르노 Emmanuel Darnaud,wine,,750,프랑스,,레드 · 생-죠셉 · 94점,wine21,true
"도멘 뚤로 주이요, 부르고뉴 루즈",도멘 뚤로 주이요 Domaine Theulot Juillot,wine,,750,프랑스,,레드 · 꼬뜨 샬로네즈,wine21,true
"도멘 뚤로 주이요, 부르고뉴 꼬뜨 샬로네즈 샤르도네",도멘 뚤로 주이요 Domaine Theulot Juillot,wine,,750,프랑스,,화이트 · 꼬뜨 샬로네즈,wine21,true
"도멘 뚤로 주이요, 메르퀴레 프리미에 크뤼 모노폴 '라 까이유트'",도멘 뚤로 주이요 Domaine Theulot Juillot,wine,,750,프랑스,,레드 · 메르퀴레,wine21,true
"도멘 뚤로 주이요, 메르퀴레 비에이 비뉴",도멘 뚤로 주이요 Domaine Theulot Juillot,wine,,750,프랑스,,레드 · 메르퀴레,wine21,true
"도멘 뚤로 주이요, 메르퀴레 '레 슈노' 블랑",도멘 뚤로 주이요 Domaine Theulot Juillot,wine,,750,프랑스,,화이트 · 메르퀴레,wine21,true
"도멘 뚤로 주이요, 메르퀴레 '심플르멍'",도멘 뚤로 주이요 Domaine Theulot Juillot,wine,,750,프랑스,,레드 · 메르퀴레,wine21,true
"파고스 델 레이, 파고 드 푸엔테코호",파고스 델 레이 Pagos del Rey,wine,,750,스페인,,레드 · 리베라 델 두에로,wine21,true
"레 오 막쉬, 피노 누아",레 오 막쉬 Les Hautes Marches,wine,,750,프랑스,,레드 · 랑그독 루씨용,wine21,true
"레 오 막쉬, 샤도네이",레 오 막쉬 Les Hautes Marches,wine,,750,프랑스,,화이트 · 랑그독 루씨용,wine21,true
"발렛 마린, 소비뇽 블랑, 그로 망상",발렛 마린 Ballet Marin,wine,,750,프랑스,,화이트 · 꼬뜨 드 가스꼬뉴,wine21,true
"닉 하셀그로브, 클레런스 힐 아들레이드 카베르네 소비뇽",닉 하셀그로브 와인즈 Nick Haselgrove Wines,wine,,750,호주,,레드 · 맥라렌 베일,wine21,true
"닉 하셀그로브, 클레런스 힐 맥라렌베일 쉬라즈",닉 하셀그로브 와인즈 Nick Haselgrove Wines,wine,,750,호주,,레드 · 맥라렌 베일,wine21,true
"월넛블럭, 넛크래커 소비뇽 블랑",월넛블럭 와인즈 Walnut Block Wines,wine,,750,뉴질랜드,,화이트 · 말보로,wine21,true
"월넛블럭, 컬렉터블스 소비뇽 블랑",월넛블럭 와인즈 Walnut Block Wines,wine,,750,뉴질랜드,,화이트 · 말보로,wine21,true
"유토포스, 모먼츠 오브 클래리티 카베르네 소비뇽",유토포스 빈야드 Utopos Vineyard,wine,,750,호주,,레드 · 바로사 밸리,wine21,true
"유토포스, 모먼츠 오브 클래리티 쉬라즈",유토포스 빈야드 Utopos Vineyard,wine,,750,호주,,레드 · 바로사 밸리,wine21,true
"유토포스, 모먼츠 오브 클래리티 메를로",유토포스 빈야드 Utopos Vineyard,wine,,750,호주,,레드 · 바로사 밸리,wine21,true
"유토포스, 모먼츠 오브 클래리티 샤도네이",유토포스 빈야드 Utopos Vineyard,wine,,750,호주,,화이트 · 바로사 밸리,wine21,true
"유토포스, 모먼츠 오브 클래리티 스파클링",유토포스 빈야드 Utopos Vineyard,wine,,750,호주,,스파클링 · 바로사 밸리,wine21,true
"도멘 라 부지에르, 지공다스",도멘 라 부지에르 Domaine la Bouissiere,wine,,750,프랑스,,레드 · 지공다스 · 94점,wine21,true
도멘 라 부지에르 지공다스 '라 퐁 드 또넝',도멘 라 부지에르 Domaine la Bouissiere,wine,,750,프랑스,,레드 · 지공다스 · 93.5점,wine21,true
"도멘 라 부지에르, 바께이라스",도멘 라 부지에르 Domaine la Bouissiere,wine,,750,프랑스,,레드 · 지공다스 · 90점,wine21,true
"라셰또, 부브레 비에유 비뉴",GCF 그룹 GCF Group,wine,,750,프랑스,,화이트 · 부브레,wine21,true
"레 파셀레르 드 쏘, 샹볼 뮤지니 프리미에 크뤼 '레 푸셀로뜨'",레 파셀레르 드 쏘 Les Parcellaires de Saulx,wine,,750,프랑스,,레드 · 샹볼 뮈지니,wine21,true
"레 파셀레르 드 쏘, 뫼르소 프리미에 크뤼 '레 상뜨노'",레 파셀레르 드 쏘 Les Parcellaires de Saulx,wine,,750,프랑스,,화이트 · 뫼르소,wine21,true
"레 파셀레르 드 쏘, 뫼르소 '르 프레 드 망슈'",레 파셀레르 드 쏘 Les Parcellaires de Saulx,wine,,750,프랑스,,화이트 · 뫼르소,wine21,true
"레 파셀레르 드 쏘, 생 또뱅 프리미에 크뤼 '레 뮈르제 데 덩뜨 드 시앙'",레 파셀레르 드 쏘 Les Parcellaires de Saulx,wine,,750,프랑스,,화이트 · 생-오방,wine21,true
"레 파셀레르 드 쏘, 페르낭 베르쥴레스 '수 레 클루'",레 파셀레르 드 쏘 Les Parcellaires de Saulx,wine,,750,프랑스,,화이트 · 뻬르낭-베르즐레스,wine21,true
"비비 그라츠, 까사마타 로쏘 '포데리 디 피에졸레'",비비 그라츠 Bibi Graetz,wine,,750,이탈리아,,레드 · 토스카나,wine21,true
"비비 그라츠, 까사마타 비앙코 '이솔라 델 질리오'",비비 그라츠 Bibi Graetz,wine,,750,이탈리아,,화이트 · 토스카나 · 93점,wine21,true
"마라미에로, 단테 마라미에로 몬테풀치아노 다브루쪼",마라미에로 Marramiero,wine,,750,이탈리아,,레드 · 몬테풀치아노,wine21,true
봉 보야쥬 쇼비뇽 블랑,GCF 그룹 GCF Group,wine,,750,독일,,화이트,wine21,true
봉 보야쥬 스파클링 피노 누아,GCF 그룹 GCF Group,wine,,750,독일,,스파클링,wine21,true
"샤또 푸에슈오, 떼뜨 드 벨리에 블랑",샤또 푸에슈오 Chateau Puech-Haut,wine,,750,프랑스,,화이트 · 랑그독 루씨용 · 91점,wine21,true
"버롱가 힐, 버롱가 힐 에스테이트 쉬라즈",버롱가 힐 와이너리 Buronga Hill Winery,wine,,750,호주,,레드 · 사우스 이스턴 오스트레일리아,wine21,true
"버롱가 힐, 버롱가 힐 에스테이트 쇼비뇽 블랑",버롱가 힐 와이너리 Buronga Hill Winery,wine,,750,호주,,화이트 · 사우스 이스턴 오스트레일리아,wine21,true
"루쏘, 포지오 알레 비페레",루쏘 Russo,wine,,750,이탈리아,,레드 · 토스카나 · 93점,wine21,true
"도멘 장 푸르니에, 쥬브레 샹베르탱",도멘 장 푸르니에 Domaine Jean Fournier,wine,,750,프랑스,,레드 · 쥬브레-샹베르땅,wine21,true
"도멘 장 푸르니에, 쥬브레 샹베르탱 프리미에 크뤼 '레 셩포'",도멘 장 푸르니에 Domaine Jean Fournier,wine,,750,프랑스,,레드 · 쥬브레-샹베르땅,wine21,true
"도멘 장 푸르니에, 알록스 꼬르통",도멘 장 푸르니에 Domaine Jean Fournier,wine,,750,프랑스,,레드 · 알록스-꼬르통,wine21,true
"도멘 장 푸르니에, 부르고뉴 오리진 블랑",도멘 장 푸르니에 Domaine Jean Fournier,wine,,750,프랑스,,화이트 · 부르고뉴,wine21,true
"도멘 장 푸르니에, 부르고뉴 꼬뜨 도르 루즈",도멘 장 푸르니에 Domaine Jean Fournier,wine,,750,프랑스,,레드 · 꼬뜨 도르,wine21,true
"도멘 장 푸르니에, 마르사네 '르 샤피트르'",도멘 장 푸르니에 Domaine Jean Fournier,wine,,750,프랑스,,레드 · 막사네 · 92.5점,wine21,true
"도멘 장 푸르니에, 마르사네 '끌로 뒤 루아'",도멘 장 푸르니에 Domaine Jean Fournier,wine,,750,프랑스,,레드 · 막사네 · 92점,wine21,true
"도멘 장 푸르니에, 마르사네 뀌베 생 위흐방 블랑",도멘 장 푸르니에 Domaine Jean Fournier,wine,,750,프랑스,,화이트 · 막사네 · 90점,wine21,true
"도멘 장 푸르니에, 끌로 부죠 그랑 크뤼 '르 그랑 모페르튀'",도멘 장 푸르니에 Domaine Jean Fournier,wine,,750,프랑스,,레드 · 부조,wine21,true
"도멘 뒤 떼름, 지공다스",도멘 뒤 떼름 Domaine du Terme,wine,,750,프랑스,,레드 · 지공다스 · 93.3점,wine21,true
"도멘 뒤 떼름, 지공다스 리저브",도멘 뒤 떼름 Domaine du Terme,wine,,750,프랑스,,레드 · 지공다스 · 93.5점,wine21,true
"도멘 뒤 떼름, 바께이라스",도멘 뒤 떼름 Domaine du Terme,wine,,750,프랑스,,레드 · 바께이라 · 92.7점,wine21,true
"도멘 드 라 뚜르, 샤블리",도멘 드 라 뚜르 Domaine de la Tour,wine,,750,프랑스,,화이트 · 샤블리,wine21,true
"도멘 드 라 뚜르, 샤블리 프리미에 크뤼 '몽멩'",도멘 드 라 뚜르 Domaine de la Tour,wine,,750,프랑스,,화이트 · 샤블리 프리미에 크뤼,wine21,true
"도멘 드 라 뚜르, 부르고뉴 알리고떼",도멘 드 라 뚜르 Domaine de la Tour,wine,,750,프랑스,,화이트 · 부르고뉴,wine21,true
"메종 하버, 쥬브레 샹베르탱 '엉 비야드'",메종 하버 Maison Harbour,wine,,750,프랑스,,화이트 · 쥬브레-샹베르땅,wine21,true
"메종 하버, 뫼르소 1er Cru 블라니",메종 하버 Maison Harbour,wine,,750,프랑스,,화이트 · 뫼르소,wine21,true
"메종 하버, 알리고테",메종 하버 Maison Harbour,wine,,750,프랑스,,화이트 · 부르고뉴,wine21,true
"메종 라, 피노누아",메종 라 Maison La,wine,,750,프랑스,,레드,wine21,true
"메종 라, G/S",메종 라 Maison La,wine,,750,프랑스,,레드,wine21,true
"도멘 타카히코, 블랑 드 누아",도멘 타카히코 Domaine Takahiko,wine,,750,일본,,화이트,wine21,true
"도멘 타카히코, 요이치 노보리",도멘 타카히코 Domaine Takahiko,wine,,750,일본,,레드,wine21,true
"도멘 아쉬, 몽듀즈",도멘 아쉬 Domaine H,wine,,750,프랑스,,화이트 · 사부아 뷔게이,wine21,true
"도멘 아쉬, 시냥 베르제롱",도멘 아쉬 Domaine H,wine,,750,프랑스,,화이트 · 사부아 뷔게이,wine21,true
"도멘 아쉬, 시냥",도멘 아쉬 Domaine H,wine,,750,프랑스,,화이트 · 사부아 뷔게이,wine21,true
"끌로 후자, 르 끌로",끌로 후자 Clos Rougeard,wine,,750,프랑스,,레드 · 소뮈르-샹삐니,wine21,true
"벤자민 르루, 뫼르소 '레 비레유일'",벤자민 르루 Benjamin Leroux,wine,,750,프랑스,,화이트 · 뫼르소,wine21,true
"벤자민 르루, 뫼르소 '레 나르보'",벤자민 르루 Benjamin Leroux,wine,,750,프랑스,,화이트 · 뫼르소,wine21,true
"벤자민 르루, 뫼르소 1er Cru 블라니",벤자민 르루 Benjamin Leroux,wine,,750,프랑스,,화이트 · 뫼르소,wine21,true
"벤자민 르루, 뫼르소",벤자민 르루 Benjamin Leroux,wine,,750,프랑스,,화이트 · 뫼르소,wine21,true
"위베르 라미, 상뜨네 1er Cru",위베르 라미 Hubert Lamy,wine,,750,프랑스,,레드 · 상트네,wine21,true
