name,brand,category,abv,volume_ml,origin,avg_price,tasting_notes,source,verified
"미구엘 토레스, 알마도",미구엘 토레스 칠레 Miguel Torres Chile,wine,,750,칠레,,레드 · 마울레 밸리,wine21,true
"미구엘 토레스, 에스칼레라스 데 엠페드라도 피노 누아",미구엘 토레스 칠레 Miguel Torres Chile,wine,,750,칠레,,레드 · 마울레 밸리,wine21,true
"찰스 시몬, 샴페인 브륏",샴페인 찰스 시몬 Champagne Charles Simon,wine,,750,프랑스,,스파클링 · 샹빠뉴,wine21,true
"리오 데 코브레, 리제르바 에스페샬 까베네 쇼비뇽",우르메네타 Urmeneta,wine,,750,칠레,,레드 · 카차포알 밸리,wine21,true
"꼴레모로, 몬테풀치아노 다부르쪼 밀라",칸띠나 꼴레 모로 Catina Colle Moro,wine,,750,이탈리아,,레드 · 아브루쪼,wine21,true
샤또 벨뷰 숄레 보르도,엠씨 컨설턴트 MC Consultant SARL,wine,,750,프랑스,,레드 · 보르도,wine21,true
"도멘 기 보카드, 뫼르소 블랑 나르보",도멘 기 보카드 Domaine Guy Bocard,wine,,750,프랑스,,화이트 · 뫼르소,wine21,true
"도멘 기 보카드, 뫼르소 프리이머 크뤼 샤름 블랑",도멘 기 보카드 Domaine Guy Bocard,wine,,750,프랑스,,화이트 · 뫼르소,wine21,true
"도멘 기 보카드, 뫼르소 블랑 비에 비뉴",도멘 기 보카드 Domaine Guy Bocard,wine,,750,프랑스,,화이트 · 뫼르소,wine21,true
"도멘 기 보카드, 꼬뜨 도르 블랑",도멘 기 보카드 Domaine Guy Bocard,wine,,750,프랑스,,화이트 · 꼬뜨 도르,wine21,true
"도멘 기 보카드, 오세 뒤레스 프리미에 크뤼 르루 블랑",도멘 기 보카드 Domaine Guy Bocard,wine,,750,프랑스,,화이트 · 오쎄-뒤레쓰,wine21,true
"피에르 고비야, 밀레짐",피에르 고비야 Pierre Gobillard,wine,,750,프랑스,,스파클링 · 샹빠뉴,wine21,true
"피에르 고비야, 뀌베 프레스티지",피에르 고비야 Pierre Gobillard,wine,,750,프랑스,,스파클링 · 샹빠뉴,wine21,true
"피에르 고비야, 블랑 드 누아 프리미에 크뤼",피에르 고비야 Pierre Gobillard,wine,,750,프랑스,,스파클링 · 샹빠뉴,wine21,true
피에르 고비야 블랑 드 블랑 프리미에 크뤼,피에르 고비야 Pierre Gobillard,wine,,750,프랑스,,스파클링 · 샹빠뉴,wine21,true
"피에르 고비야, 브뤼 리저브 프리미에 크뤼",피에르 고비야 Pierre Gobillard,wine,,750,프랑스,,스파클링 · 샹빠뉴,wine21,true
"피에르 고비야, 브뤼 오턴티크",피에르 고비야 Pierre Gobillard,wine,,750,프랑스,,스파클링 · 샹빠뉴,wine21,true
"카스텔베끼오, 프리모레 모스카토 다스티",칸티네 만프레디 Cantine Manfredi,wine,,750,이탈리아,,화이트 · 아스티,wine21,true
"카스텔베끼오, 프리모레 모스카토 스푸만테 로제",칸티네 만프레디 Cantine Manfredi,wine,,750,이탈리아,,스파클링 · 피에몬테,wine21,true
"카스텔베끼오, 네비올로 달바",칸티네 만프레디 Cantine Manfredi,wine,,750,이탈리아,,레드 · 알바,wine21,true
"카스텔베끼오, 랑게 네비올로",칸티네 만프레디 Cantine Manfredi,wine,,750,이탈리아,,레드 · 랑게,wine21,true
"카스텔베끼오, 바르바레스코",칸티네 만프레디 Cantine Manfredi,wine,,750,이탈리아,,레드 · 바르바레스코,wine21,true
"카스텔베끼오, 바롤로",칸티네 만프레디 Cantine Manfredi,wine,,750,이탈리아,,레드 · 바롤로,wine21,true
"테누타 카수치오 탈레티, 끼안띠 클라시코",테누타 카수치오 탈레티 Tenuta Casuccio Tarletti,wine,,750,이탈리아,,레드 · 토스카나,wine21,true
"테누타 바라크, 바르바레스코",테누타 바라크 Tenuta Barac,wine,,750,이탈리아,,레드 · 바르바레스코,wine21,true
"테누타 바라크, 바롤로",테누타 바라크 Tenuta Barac,wine,,750,이탈리아,,레드 · 바롤로,wine21,true
"꽁트리 스푸만티, 레전드 진",꽁트리 스푸만티 Contri Spumanti,wine,,750,이탈리아,,레드 · 뿔리아,wine21,true
"도멘 피에르 부아송, 부르고뉴 알리고떼",도멘 피에르 부아송 Domaine Pierre Boisson,wine,,750,프랑스,,화이트 · 부르고뉴,wine21,true
"인비보, X, SJP 소비뇽 블랑",인비보 Invivo,wine,,750,뉴질랜드,,화이트 · 말보로,wine21,true
폭스 브룩 모스카토,브랑코 와인 컴퍼니 Bronco wine Company,wine,,750,미국,,화이트 · 캘리포니아,wine21,true
코스탈릿지 화이트 진판델,코스탈 릿지 Coastal Ridge,wine,,750,미국,,로제 · 캘리포니아,wine21,true
코스탈릿지 샤도네이,코스탈 릿지 Coastal Ridge,wine,,750,미국,,화이트 · 캘리포니아,wine21,true
러더포드 빈트너스 샤도네이,브랑코 와인 컴퍼니 Bronco wine Company,wine,,750,미국,,화이트 · 나파 밸리,wine21,true
러더포드 빈트너스 카베르네 쇼비뇽,브랑코 와인 컴퍼니 Bronco wine Company,wine,,750,미국,,레드 · 나파 밸리,wine21,true
원스 어폰 어 바인 인챈티드 버블리 화이트,브랑코 와인 컴퍼니 Bronco wine Company,wine,,750,미국,,스파클링 · 캘리포니아,wine21,true
"휴먼셀러, 루디 리즐링",휴먼셀러 Human Cellars,wine,,750,미국,,화이트 · 에오라-아미티 힐즈,wine21,true
"휴먼셀러,그랑제로 샤도네이",휴먼셀러 Human Cellars,wine,,750,미국,,화이트 · 에오라-아미티 힐즈,wine21,true
"휴먼셀러, 드 부이 가메",휴먼셀러 Human Cellars,wine,,750,미국,,레드 · 에오라-아미티 힐즈,wine21,true
"솔레나, 피노누아 DDL",솔레나 Solena,wine,,750,미국,,레드 · 얌힐-칼튼 · 93점,wine21,true
"메종 누아, 오피피 피노누아",메종 누아 Maison Noir,wine,,750,미국,,레드 · 윌라메트 밸리,wine21,true
"베컴 에스테이트, 애드 베컴 리즐링",베컴 에스테이트 빈야드 Beckham Estate Vineyard,wine,,750,미국,,화이트 · 체할렘 마운틴,wine21,true
"베컴 에스테이트, 애드 베컴 암포라 피노그리",베컴 에스테이트 빈야드 Beckham Estate Vineyard,wine,,750,미국,,레드 · 체할렘 마운틴,wine21,true
"베컴 에스테이트, 애드 베컴 에이퀄리스 피노그리 - 피노누아",베컴 에스테이트 빈야드 Beckham Estate Vineyard,wine,,750,미국,,레드 · 체할렘 마운틴,wine21,true
"레조낭스, 윌라멧 밸리 샤도네이",레조낭스 Resonance,wine,,750,미국,,화이트 · 오리건 · 96점,wine21,true
"레조낭스, 윌라멧 밸리 피노누아",레조낭스 Resonance,wine,,750,미국,,레드 · 오리건,wine21,true
"레조낭스, 쿠사 빈야드 샤도네이",레조낭스 Resonance,wine,,750,미국,,화이트 · 에오라-아미티 힐즈,wine21,true
"레조낭스, 데꾸베르트 빈야드 피노누아",레조낭스 Resonance,wine,,750,미국,,레드 · 던디 힐,wine21,true
"레조낭스, 레조낭스 빈야드 피노누아",레조낭스 Resonance,wine,,750,미국,,레드 · 얌힐-칼튼 · 96점,wine21,true
"펠프스 크릭, 레지나 포마드 피노 누아",펠프스 크릭 빈야즈 Phelps Creek Vineyards,wine,,750,미국,,레드 · 콜롬비아 고지  · 91점,wine21,true
"아워글래스, 에스테이트, 쇼비뇽 블랑",아워글래스 Hourglass,wine,,750,미국,,화이트 · 나파 카운티,wine21,true
"판티니, 까살레 베끼오 몬테풀치아노 다브루쪼 블랙",판티니 그룹 Fantini Group,wine,,750,이탈리아,,레드 · 몬테풀치아노 · 93점,wine21,true
"로저 구라트, 루미너스 로제",로저 구라트 Roger Goulart,wine,,750,스페인,,스파클링 · 페네데스,wine21,true
"로저 구라트, 루미너스 엑스트라 브륏",로저 구라트 Roger Goulart,wine,,750,스페인,,스파클링 · 페네데스,wine21,true
"링구아 프랑카, 에스테이트 피노누아",링구아 프랑카 Lingua Franca,wine,,750,미국,,레드 · 윌라메트 밸리 · 93.6점,wine21,true
"링구아 프랑카, 아브니 피노누아",링구아 프랑카 Lingua Franca,wine,,750,미국,,레드 · 윌라메트 밸리 · 93점,wine21,true
"링구아 프랑카, 아브니 샤르도네",링구아 프랑카 Lingua Franca,wine,,750,미국,,화이트 · 윌라메트 밸리 · 92.8점,wine21,true
"부커 빈야드, 프랙처",부커 빈야드 Booker Vineyard,wine,,750,미국,,레드 · 파소 로블스 · 95.3점,wine21,true
"부커 빈야드, 버티고",부커 빈야드 Booker Vineyard,wine,,750,미국,,레드 · 파소 로블스 · 94점,wine21,true
"펠릭스 솔리스, 피츠로이 베이 쇼비뇽 블랑",펠리스 솔리스 Felix Solis,wine,,750,뉴질랜드,,화이트 · 말보로,wine21,true
"비르겐 델 갈리르, 발 도 갈리르 멘시아",비르겐 델 갈리르 Virgen del Galir,wine,,750,스페인,,레드 · 발데오라스 · 91.6점,wine21,true
"비르겐 델 갈리르, 발 도 갈리르 고데요",비르겐 델 갈리르 Virgen del Galir,wine,,750,스페인,,화이트 · 발데오라스 · 91.8점,wine21,true
"미셸 바텅, 상세르 엘-오",미셸 바텅 Michel Vattan,wine,,750,프랑스,,화이트 · 상세르 · 93점,wine21,true
"미셸 바텅, 상세르 씨-오",미셸 바텅 Michel Vattan,wine,,750,프랑스,,화이트 · 상세르,wine21,true
"미셸 바텅, 상세르 엠-케이",미셸 바텅 Michel Vattan,wine,,750,프랑스,,화이트 · 상세르 · 89.3점,wine21,true
"미셸 바텅, 상세르 오-피",미셸 바텅 Michel Vattan,wine,,750,프랑스,,화이트 · 상세르 · 88.5점,wine21,true
"샴페인 로저 바르니에, 뀌베 익스퀴즈 브륏",로저 바르니에 Roger Barnier,wine,,750,프랑스,,스파클링 · 샹빠뉴 · 93점,wine21,true
"샴페인 로저 바르니에, 셀렉시옹 브륏",로저 바르니에 Roger Barnier,wine,,750,프랑스,,스파클링 · 샹빠뉴 · 88점,wine21,true
"빠리고 앤 리차드, 빠리고 프로펫 크레망 드 부르고뉴 엑스트라 브륏",빠리고 & 리차드 Parigot & Richard,wine,,750,프랑스,,스파클링 · 부르고뉴,wine21,true
"빠리고 앤 리차드, 빠리고 라 상티넬 크레망 드 부르고뉴 엑스트라 브륏",빠리고 & 리차드 Parigot & Richard,wine,,750,프랑스,,스파클링 · 부르고뉴 · 91점,wine21,true
"빠리고 앤 리차드, 빠리고 오리진 크레망 드 부르고뉴 브륏",빠리고 & 리차드 Parigot & Richard,wine,,750,프랑스,,스파클링 · 부르고뉴 · 90점,wine21,true
"아우구스트 케셀러, 더 데일리 아우구스트 피노 누아 트로켄",아우구스트 케셀러 August Kesseler,wine,,750,독일,,레드 · 라인가우 · 91점,wine21,true
"아우구스트 케셀러, 뤼데스하임 리슬링 트로켄",아우구스트 케셀러 August Kesseler,wine,,750,독일,,화이트 · 라인가우 · 91.8점,wine21,true
"엘지아이 와인, 레모낭",엘지아이 와인 LGI Wines,wine,,750,프랑스,,화이트 · 랑그독 루씨용,wine21,true
"엘지아이 와인, 지에스엠 엘라보라시옹",엘지아이 와인 LGI Wines,wine,,750,프랑스,,레드 · 랑그독 루씨용,wine21,true
"카사 로호, 도쿄 고메즈 로호 세컨트",카사 로호 Casa Rojo,wine,,750,스페인,,레드 · 무르시아,wine21,true
"카사 로호, 도쿄 고메즈 로호 라 말파가다",카사 로호 Casa Rojo,wine,,750,스페인,,화이트 · 리베라 델 두에로,wine21,true
"카사 로호, 도쿄 고메즈 로호",카사 로호 Casa Rojo,wine,,750,스페인,,레드 · 리베라 델 두에로,wine21,true
"도멘 오뜨, 에뚜알",도멘 오뜨 Domaines Ott,wine,,750,프랑스,,로제,wine21,true
"몬테니어, 르 오렌지",몬테니어 에스테이트 Montinore Estate,wine,,750,미국,,로제 · 윌라메트 밸리,wine21,true
"스톨러, 리저브 피노누아",스톨러 패밀리 에스테이트	 Stoller Family Estate,wine,,750,미국,,레드 · 던디 힐 · 92.3점,wine21,true
"하이랜드, 에스테이트 샤도네이",하이랜드 에스테이트 Hyland Estates,wine,,750,미국,,화이트 · 맥민빌,wine21,true
"하이랜드, 쿠리 싱글 클론 피노누아",하이랜드 에스테이트 Hyland Estates,wine,,750,미국,,레드 · 맥민빌 · 93.3점,wine21,true
"베츠 패밀리 와이너리, 퀸타 어쎈시아",베츠 패밀리 와이너리 Betz Family Winery,wine,,750,남아프리카,,화이트 · 스텔렌보쉬,wine21,true
"오스트레일리안 빈트너스, 렌마크 크릭 카버네 소비뇽",오스트레일리안 빈트너스 Australian Vintners,wine,,750,호주,,레드 · 리버랜드,wine21,true
"토이메이커 셀라즈, 틴솔저 까베르네 소비뇽",토이메이커 셀라즈 Toymaker Cellars,wine,,750,미국,,레드 · 나파 밸리,wine21,true
"토이메이커 셀라즈, 토이메이커 까베르네 소비뇽",토이메이커 셀라즈 Toymaker Cellars,wine,,750,미국,,레드 · 나파 밸리 · 94점,wine21,true
"폴 미트나흐, 피노누아",폴 미트나흐 Paul Mittnacht,wine,,750,프랑스,,레드 · 알자스,wine21,true
"폴 미트나흐, 크레망",폴 미트나흐 Paul Mittnacht,wine,,750,프랑스,,스파클링 · 알자스,wine21,true
"폴 미트나흐, 리슬링",폴 미트나흐 Paul Mittnacht,wine,,750,프랑스,,화이트 · 알자스,wine21,true
"폴 미트나흐, 뮈스까",폴 미트나흐 Paul Mittnacht,wine,,750,프랑스,,화이트 · 알자스,wine21,true
"폴 미트나흐, 게뷔르츠트라미너",폴 미트나흐 Paul Mittnacht,wine,,750,프랑스,,화이트 · 알자스,wine21,true
센티엄,센티엄 Sentium,wine,,750,미국,,화이트 · 멘도치노,wine21,true
노비시엄,컨티뉴엄 Continuum Estate,wine,,750,미국,,레드 · 나파 밸리,wine21,true
"리브 와인, 야 문 피노 누아",노아 & 켈리 도란스 Noah & Kelly Dorrance,wine,,750,미국,,레드 · 포터 밸리,wine21,true
"끌로 산타 아나, 아랄레즈",끌로 산타 아나 Clos Santa Ana,wine,,750,칠레,,레드 · 콜차구아 밸리,wine21,true
"끌로 산타 아나, 시리우스",끌로 산타 아나 Clos Santa Ana,wine,,750,칠레,,레드 · 콜차구아 밸리,wine21,true
"끌로 산타 아나, 벨로",끌로 산타 아나 Clos Santa Ana,wine,,750,칠레,,화이트 · 콜차구아 밸리,wine21,true
"파셀 에스테이트, 쉬라즈",파셀 에스테이트 Passel Estate,wine,,750,호주,,레드 · 마가렛 리버 · 92점,wine21,true
"파셀 에스테이트, 샤르도네",파셀 에스테이트 Passel Estate,wine,,750,호주,,화이트 · 마가렛 리버 · 93점,wine21,true
"울쉬드, 소비뇽 블랑",울쉬드 Woolshed,wine,,750,호주,,화이트 · 빅토리아,wine21,true
"울쉬드, 샤르도네",울쉬드 Woolshed,wine,,750,호주,,화이트 · 빅토리아,wine21,true
"울쉬드, 까베르네 소비뇽",울쉬드 Woolshed,wine,,750,호주,,레드 · 사우스 이스턴 오스트레일리아,wine21,true
"울쉬드, 쉬라즈",울쉬드 Woolshed,wine,,750,호주,,레드 · 사우스 이스턴 오스트레일리아,wine21,true
"크래기 레인지, 와일드 락 말보로 소비뇽 블랑",크래기 레인지 Craggy Range,wine,,750,뉴질랜드,,화이트 · 말보로,wine21,true
"크래기 레인지, 김블렛 그레블스 빈야드 쉬라",크래기 레인지 Craggy Range,wine,,750,뉴질랜드,,레드 · 마틴보로 · 97점,wine21,true
"크래기 레인지, 키드네이퍼스 빈야드 샤르도네",크래기 레인지 Craggy Range,wine,,750,뉴질랜드,,화이트 · 마틴보로 · 93점,wine21,true
"끌로 루슬리, 땅 당스 로제",도멘 끌로 루슬리 Domaine Clos Rossely,wine,,750,프랑스,,로제 · 뚜렌느,wine21,true
"끌로 루슬리, 레스깔 소비뇽 블랑",도멘 끌로 루슬리 Domaine Clos Rossely,wine,,750,프랑스,,화이트 · 뚜렌느,wine21,true
"끌로 루슬리, 까나이유 가메",도멘 끌로 루슬리 Domaine Clos Rossely,wine,,750,프랑스,,레드 · 뚜렌느,wine21,true
"도멘 징크, 게부르츠트라미너",도멘 징크 Domaine Zinck,wine,,750,프랑스,,화이트 · 알자스,wine21,true
"도멘 징크, 리슬링",도멘 징크 Domaine Zinck,wine,,750,프랑스,,화이트 · 알자스,wine21,true
"도멘 징크, 피노 블랑",도멘 징크 Domaine Zinck,wine,,750,프랑스,,화이트 · 알자스,wine21,true
샤또 라 퐁 뇌브,메종 지네스떼 Maison Ginestet,wine,,750,프랑스,,레드 · 메독,wine21,true
"듀체스 데 빠스트흐, 샤르도네",듀체스 데 빠스트흐 Duchesse des Pastres,wine,,750,프랑스,,화이트 · 랑그독 루씨용,wine21,true
"듀체스 데 빠스트흐, 피노 누아",듀체스 데 빠스트흐 Duchesse des Pastres,wine,,750,프랑스,,레드 · 랑그독 루씨용,wine21,true
"듀체스 데 빠스트흐, 까베르네 소비뇽",듀체스 데 빠스트흐 Duchesse des Pastres,wine,,750,프랑스,,레드 · 랑그독 루씨용,wine21,true
"레 프레 베흐, 샤르도네",레 프레 베흐 Les Prés Verts,wine,,750,프랑스,,화이트 · 랑그독 루씨용,wine21,true
"레 프레 베흐, 피노 로제",위니옹 데 비녀롱 Union des Vignerons,wine,,750,프랑스,,로제 · 랑그독 루씨용,wine21,true
"레 프레 베흐, 까베르네 소비뇽",레 프레 베흐 Les Prés Verts,wine,,750,프랑스,,레드 · 랑그독 루씨용,wine21,true
"레 프레 베흐, 피노 누아",레 프레 베흐 Les Prés Verts,wine,,750,프랑스,,레드 · 랑그독 루씨용,wine21,true
"폴레츠키 와이너리, 크리스마스 토카이",폴레츠키 와이너리 Poletski Winery,wine,,750,헝가리,,화이트,wine21,true
"프리츠 빈디쉬, 베토벤 리슬링",프리츠 빈디쉬 와이너리 Fritz Windisch Winery,wine,,750,독일,,화이트 · 라인헤센,wine21,true
"프리츠 빈디쉬, 모짜르트 리슬링",프리츠 빈디쉬 와이너리 Fritz Windisch Winery,wine,,750,독일,,화이트 · 라인헤센,wine21,true
"지로 리보, 아방 까바 브뤼 리제르바",지로 리보 Giro Ribot,wine,,750,스페인,,스파클링 · 페네데스,wine21,true
"칸티나 젬마, 바롤로 지블린 리제르바",칸티네 젬마 Cantine Gemma,wine,,750,이탈리아,,레드 · 바롤로,wine21,true
"바론 도베른, 블랑 드 블랑 그랑크뤼",바론 도베른 Baron Dauvergne,wine,,750,프랑스,,스파클링 · 샹빠뉴,wine21,true
"뱅상 다스트레, 블랑 드 블랑",뱅상 다스트레 Vincent D'astree,wine,,750,프랑스,,스파클링 · 샹빠뉴,wine21,true
"뱅상 다스트레, 블랑 드 누아",뱅상 다스트레 Vincent D'astree,wine,,750,프랑스,,스파클링 · 샹빠뉴,wine21,true
"뱅상 다스트레, 프리미에 크뤼",뱅상 다스트레 Vincent D'astree,wine,,750,프랑스,,스파클링 · 샹빠뉴,wine21,true
"알방 마티노, 끌레르 슈아지",알방 마티노 Albin Martinot,wine,,750,프랑스,,스파클링 · 샹빠뉴,wine21,true
"알방 마티노, 롤랑",알방 마티노 Albin Martinot,wine,,750,프랑스,,스파클링 · 샹빠뉴,wine21,true
"프랑수와 파랑, 본로마네",프랑수와 파랑 Francois Parent,wine,,750,프랑스,,레드 · 본-로마네,wine21,true
"도멘 드 라 슈페티, 상트네 프리미에 크뤼 '클로 후쏘'",도멘 드 라 슈페트 Domaine de la Choupette,wine,,750,프랑스,,레드 · 상트네,wine21,true
"도멘 드 라 슈페트, 쌍뜨네 컴듀스",도멘 드 라 슈페트 Domaine de la Choupette,wine,,750,프랑스,,레드 · 상트네,wine21,true
"도멘 드 라 슈페트, 마랑쥐 비에이비뉴",도멘 드 라 슈페트 Domaine de la Choupette,wine,,750,프랑스,,레드 · 마랑쥬 · 95점,wine21,true
"셀러 프리삭, 상 데 꼬르브",셀러 프리삭 Celler Frisach,wine,,750,스페인,,레드 · 테라 알타,wine21,true
"셀러 프리삭, 레 알리페레",셀러 프리삭 Celler Frisach,wine,,750,스페인,,화이트 · 테라 알타,wine21,true
"셀러 프리삭, 라 부르넷 네그레",셀러 프리삭 Celler Frisach,wine,,750,스페인,,레드 · 테라 알타,wine21,true
"셀러 프리삭, 라 부르넷 로사토",셀러 프리삭 Celler Frisach,wine,,750,스페인,,로제 · 테라 알타,wine21,true
"셀러 프리삭, 라브르넷 블랑",셀러 프리삭 Celler Frisach,wine,,750,스페인,,화이트 · 테라 알타,wine21,true
"4 모노스, 띠에라 데 루나",4 모노스 비티컬토레스 4 Monos Viticultores,wine,,750,스페인,,레드 · 비노스 데 마드리드,wine21,true
"4 모노스, GR-10 틴토",4 모노스 비티컬토레스 4 Monos Viticultores,wine,,750,스페인,,레드 · 비노스 데 마드리드,wine21,true
"손시에라, 퍼퓸 드 손시에라",보데가스 손시에라 Bodegas Sonsierra,wine,,750,스페인,,레드 · 리오하 알타,wine21,true
"손시에라, 블랑코 페르만타도 앙 바리카",보데가스 손시에라 Bodegas Sonsierra,wine,,750,스페인,,화이트 · 리오하 알타,wine21,true
"손시에라, 크리안자",보데가스 손시에라 Bodegas Sonsierra,wine,,750,스페인,,레드 · 리오하 알타,wine21,true
"손시에라, 셀렉시온 비우라",보데가스 손시에라 Bodegas Sonsierra,wine,,750,스페인,,화이트 · 리오하 알타,wine21,true
"손시에라, 셀렉시온 템프라니요",보데가스 손시에라 Bodegas Sonsierra,wine,,750,스페인,,레드 · 리오하 알타,wine21,true
"쿠네, 모노폴 레제르바",쿠네 CVNE,wine,,750,스페인,,화이트 · 리오하 · 93.8점,wine21,true
"빌라벨라, 발폴리첼라 클라시코",비녜티 빌라벨라 Vigneti Villabella,wine,,750,이탈리아,,레드 · 발폴리첼라,wine21,true
"빌라벨라, 소아베 클라시코",비녜티 빌라벨라 Vigneti Villabella,wine,,750,이탈리아,,화이트 · 소아베,wine21,true
"빌라벨라, 발폴리첼라 리파쏘",비녜티 빌라벨라 Vigneti Villabella,wine,,750,이탈리아,,레드 · 발폴리첼라 · 90점,wine21,true
"빌라벨라, 몬테마짜노",비녜티 빌라벨라 Vigneti Villabella,wine,,750,이탈리아,,레드 · 베로나 · 90점,wine21,true
"빌라벨라, 까 델 닌 발폴리첼라 클라시코 수페리오레",비녜티 빌라벨라 Vigneti Villabella,wine,,750,이탈리아,,레드 · 발폴리첼라 · 90점,wine21,true
"빌라벨라, 바르돌리노 키아레토 클라시코",비녜티 빌라벨라 Vigneti Villabella,wine,,750,이탈리아,,로제 · 바르돌리노,wine21,true
"빌라벨라, 아마로네 델라 발폴리첼라",비녜티 빌라벨라 Vigneti Villabella,wine,,750,이탈리아,,레드 · 발폴리첼라 · 91점,wine21,true
"빌라 꼬르데비고, 로쏘",빌라 꼬르데비고 Villa Cordevigo,wine,,750,이탈리아,,레드 · 베로나,wine21,true
"빌라 꼬르데비고, 비앙코",빌라 꼬르데비고 Villa Cordevigo,wine,,750,이탈리아,,화이트 · 베로나,wine21,true
"샤또 드 몽프린, 엥 꾸 드 데 루즈",샤또 드 몽프린 Chateau de Montfrin,wine,,750,프랑스,,레드 · 꼬뜨 뒤 론,wine21,true
"샤또 드 몽프린, 엥 꾸 드 데 블랑",샤또 드 몽프린 Chateau de Montfrin,wine,,750,프랑스,,화이트 · 꼬뜨 뒤 론,wine21,true
"빌라 꼬르데비고, 오세레타 로쏘",빌라 꼬르데비고 Villa Cordevigo,wine,,750,이탈리아,,레드 · 베로나 · 92점,wine21,true
"트리니티 힐, 오마주 쉬라",트리니티 힐 Trinity Hill,wine,,750,뉴질랜드,,레드 · 혹스 베이,wine21,true
"트리니티 힐, 싱글 빈야드 125 김블렛 샤도네이",트리니티 힐 Trinity Hill,wine,,750,뉴질랜드,,화이트 · 혹스 베이,wine21,true
"트리니티 힐, 김블렛 그래블 쉬라",트리니티 힐 Trinity Hill,wine,,750,뉴질랜드,,레드 · 혹스 베이,wine21,true
"트리니티 힐, 김블렛 그래블 샤도네이",트리니티 힐 Trinity Hill,wine,,750,뉴질랜드,,화이트 · 혹스 베이,wine21,true
"트리니티 힐, 혹스 베이 쉬라",트리니티 힐 Trinity Hill,wine,,750,뉴질랜드,,레드 · 혹스 베이,wine21,true
"트리니티 힐, 혹스 베이 샤도네이",트리니티 힐 Trinity Hill,wine,,750,뉴질랜드,,화이트 · 혹스 베이,wine21,true
"몽프린, 라 뚜르 루즈",샤또 드 몽프린 Chateau de Montfrin,wine,,750,프랑스,,레드 · 서던 프랑스,wine21,true
"몽프린, 라 뚜르 로제",샤또 드 몽프린 Chateau de Montfrin,wine,,750,프랑스,,로제 · 서던 프랑스,wine21,true
"몽프린, 라 뚜르 블랑",샤또 드 몽프린 Chateau de Montfrin,wine,,750,프랑스,,화이트 · 서던 프랑스,wine21,true
"러브블럭, 티 말보로 소비뇽 블랑",러브블럭 Loveblock,wine,,750,뉴질랜드,,화이트 · 말보로 · 91.5점,wine21,true
"러브블럭, 말보로 소비뇽 블랑",러브블럭 Loveblock,wine,,750,뉴질랜드,,화이트 · 말보로 · 91점,wine21,true
"러브블럭, 말보로 피노 그리",러브블럭 Loveblock,wine,,750,뉴질랜드,,화이트 · 말보로 · 91점,wine21,true
"엔리께 멘도자, 라 트레멘다 소비뇽 블랑 & 메르세게라",엔리께 멘도자 Enrique Mendoza,wine,,750,스페인,,화이트 · 알리칸테,wine21,true
"엔리께 멘도자, 라 트레멘다 모나스트렐",엔리께 멘도자 Enrique Mendoza,wine,,750,스페인,,레드 · 알리칸테 · 92점,wine21,true
"떼르 피델, 펠리셋 그르나슈 로제",떼르 피델 Terre Fidele,wine,,750,프랑스,,로제 · 서던 프랑스,wine21,true
"떼르 피델, 펠리셋 그르나슈 누아",떼르 피델 Terre Fidele,wine,,750,프랑스,,레드 · 랑그독 루씨용,wine21,true
"떼르 피델, 펠리셋 그르나슈 블랑",떼르 피델 Terre Fidele,wine,,750,프랑스,,화이트 · 랑그독 루씨용,wine21,true
"테라쩨 델에트나, 치르네코 에트나 로쏘",테라쩨 델레트나 Terrazze Dell'Etna,wine,,750,이탈리아,,레드 · 시칠리아 · 91점,wine21,true
"테라쩨 델에트나, 카루수 에트나 로쏘",테라쩨 델레트나 Terrazze Dell'Etna,wine,,750,이탈리아,,레드 · 시칠리아 · 90.3점,wine21,true
"테라쩨 델에트나, 친니리 에트나 비앙코",테라쩨 델레트나 Terrazze Dell'Etna,wine,,750,이탈리아,,화이트 · 시칠리아 · 92점,wine21,true
